[
  {
    "id": "awake",
    "chapter": 0,
    "title": "선착장에서 눈을 뜨다",
    "lines": [
      "파도 소리에 눈을 떴다. 낯선 선착장, 낯선 하늘. 손에 쥔 것은 낡은 무기 하나뿐이었다.",
      "“또 한 명이 왔군.” 그물을 손질하던 노인이 고개도 들지 않고 말했다. “여긴 리스항구. 세상의 끝이자, 판게아의 문이지.”",
      "여러 세계가 하나의 대륙으로 이어진 날 이후로, 바다는 기억을 잃은 모험가들을 이 항구에 내려놓는다고 했다.",
      "선착장 끝에서 무언가가 꿈틀거렸다. 생각할 틈도 없이 몸이 먼저 움직였다."
    ],
    "hint": "몬스터를 처음 처치한다",
    "trigger": {
      "kind": "first_kill",
      "value": null
    },
    "area_filter": null,
    "weight": null,
    "body": null,
    "choices": null,
    "art_hint": null,
    "tags": [
      "제1장",
      "first_kill"
    ]
  },
  {
    "id": "shell",
    "chapter": 0,
    "title": "조개 해안의 소문",
    "lines": [
      "조개껍데기가 발밑에서 바스락거렸다. 해안의 슬라임들은 겁도 없이 통통 튀어올랐다.",
      "모닥불가의 상인이 말했다. “빅토리아 아일랜드 너머엔 다른 세계가 붙어 있대. 용이 사는 땅, 시간이 멈춘 신전…”",
      "믿기 어려운 이야기였지만, 이 섬에 온 것부터가 믿기 어려운 일이었다."
    ],
    "hint": "리스항구 · 조개 해안에 간다",
    "trigger": {
      "kind": "stage_visit",
      "value": "bay"
    },
    "area_filter": null,
    "weight": null,
    "body": null,
    "choices": null,
    "art_hint": null,
    "tags": [
      "제1장",
      "stage_visit"
    ]
  },
  {
    "id": "henesys",
    "chapter": 0,
    "title": "버섯 마을 헤네시스",
    "lines": [
      "언덕 위로 커다란 버섯 지붕들이 보였다. 아이들이 나무칼을 휘두르며 모험가 흉내를 냈다.",
      "“요즘 버섯들이 이상해요.” 마을 사람은 걱정스러운 얼굴이었다. “숲 깊은 곳에서 엄청나게 큰 버섯을 봤다는 사람도 있고요.”",
      "그 말을 듣는 순간, 이상하게도 처음 듣는 이야기가 아닌 것 같았다."
    ],
    "hint": "헤네시스 사냥터에 간다",
    "trigger": {
      "kind": "region_visit",
      "value": "헤네시스"
    },
    "area_filter": null,
    "weight": null,
    "body": null,
    "choices": null,
    "art_hint": null,
    "tags": [
      "제1장",
      "region_visit"
    ]
  },
  {
    "id": "firstJob",
    "chapter": 0,
    "title": "첫 번째 길",
    "lines": [
      "전직관은 오래 내 눈을 들여다보았다. “너는 이미 이 길을 걸어 본 적이 있구나.”",
      "무슨 뜻인지 묻기도 전에 그는 증표를 건넸다. 손에 닿자 온몸에 익숙한 힘이 퍼졌다.",
      "처음 배우는 기술인데, 몸은 이미 다음 동작을 알고 있었다."
    ],
    "hint": "첫 전직을 한다",
    "trigger": {
      "kind": "job_tier",
      "value": 1
    },
    "area_filter": null,
    "weight": null,
    "body": null,
    "choices": null,
    "art_hint": null,
    "tags": [
      "제1장",
      "job_tier"
    ]
  },
  {
    "id": "mushmom",
    "chapter": 0,
    "title": "숲의 거대한 그림자",
    "lines": [
      "버섯 동산 깊은 곳, 나무보다 큰 버섯이 땅을 울리며 다가왔다. 머쉬맘이었다.",
      "쓰러진 머쉬맘의 갓 아래에서 희미하게 빛나는 돌 하나가 굴러 나왔다. 세계석이라고, 누군가 그렇게 불렀다.",
      "돌을 쥐자 머릿속에 장면이 스쳤다. 같은 숲, 같은 버섯, 그리고 지금과 다른 얼굴의 나."
    ],
    "hint": "머쉬맘을 처치한다",
    "trigger": {
      "kind": "boss_kill",
      "value": "grottoWarden"
    },
    "area_filter": null,
    "weight": null,
    "body": null,
    "choices": null,
    "art_hint": null,
    "tags": [
      "제1장",
      "boss_kill"
    ]
  },
  {
    "id": "perion",
    "chapter": 0,
    "title": "바위산의 전사들",
    "lines": [
      "붉은 바위산 페리온. 발굴지의 석상들은 이 대륙이 생기기 전의 문자로 뒤덮여 있었다.",
      "고고학자가 탁본을 내밀었다. “‘세계는 하나가 되고, 모험가는 끝없이 돌아오리라.’ 무슨 뜻일까요?”",
      "대답하지 못했다. 다만 그 문장을 어디선가 직접 새긴 것 같은 기분이 들었다."
    ],
    "hint": "페리온 사냥터에 간다",
    "trigger": {
      "kind": "region_visit",
      "value": "페리온"
    },
    "area_filter": null,
    "weight": null,
    "body": null,
    "choices": null,
    "art_hint": null,
    "tags": [
      "제1장",
      "region_visit"
    ]
  },
  {
    "id": "ellinia",
    "chapter": 0,
    "title": "마법 숲의 속삭임",
    "lines": [
      "엘리니아의 나무들은 하늘을 가릴 만큼 높았다. 달빛 호수에 비친 내 모습이 잠시 흔들렸다.",
      "“세계석을 모으고 있군요.” 요정 마법사가 말했다. “그건 지나간 생의 조각이에요. 충분히 모으면, 다시 태어나도 잃지 않죠.”"
    ],
    "hint": "엘리니아 사냥터에 간다",
    "trigger": {
      "kind": "region_visit",
      "value": "엘리니아"
    },
    "area_filter": null,
    "weight": null,
    "body": null,
    "choices": null,
    "art_hint": null,
    "tags": [
      "제1장",
      "region_visit"
    ]
  },
  {
    "id": "kerning",
    "chapter": 0,
    "title": "네온 아래의 거래",
    "lines": [
      "커닝시티의 밤은 낮보다 밝았다. 골목마다 정보가 사고팔렸다.",
      "후드를 쓴 남자가 속삭였다. “요즘 이상한 놈들이 많아. 대륙 밖에서 온 것 같은 놈들. 칼 대신 숫자를 다루지.”",
      "그는 동전을 튕기며 웃었다. “너도 언젠가 그쪽에 관심이 생길걸.”"
    ],
    "hint": "커닝시티 사냥터에 간다",
    "trigger": {
      "kind": "region_visit",
      "value": "커닝시티"
    },
    "area_filter": null,
    "weight": null,
    "body": null,
    "choices": null,
    "art_hint": null,
    "tags": [
      "제1장",
      "region_visit"
    ]
  },
  {
    "id": "secondJob",
    "chapter": 0,
    "title": "갈림길",
    "lines": [
      "두 번째 증표를 받았다. 이번에는 전직관이 아무 말도 하지 않았다. 그럴 필요가 없다는 듯이.",
      "길은 여러 갈래였고, 어느 길을 골라도 언젠가 다른 길과 다시 만날 것 같았다."
    ],
    "hint": "2차 전직을 한다",
    "trigger": {
      "kind": "job_tier",
      "value": 2
    },
    "area_filter": null,
    "weight": null,
    "body": null,
    "choices": null,
    "art_hint": null,
    "tags": [
      "제1장",
      "job_tier"
    ]
  },
  {
    "id": "rebirth1",
    "chapter": 1,
    "title": "다시 눈을 뜨다",
    "lines": [
      "파도 소리에 눈을 떴다. 같은 선착장, 같은 하늘. 그런데 이번에는 모든 것을 기억하고 있었다.",
      "노인이 그물에서 고개를 들었다. “돌아왔군. 이번엔 조금 빨랐어.”",
      "손안의 세계석이 따뜻했다. 지난 생에서 얻은 것들이 그 안에 고스란히 남아 있었다.",
      "판게아는 모험가를 죽게 두지 않는다. 다만 처음으로 돌려보낼 뿐이다."
    ],
    "hint": "첫 환생을 한다",
    "trigger": {
      "kind": "rebirths",
      "value": 1
    },
    "area_filter": null,
    "weight": null,
    "body": null,
    "choices": null,
    "art_hint": null,
    "tags": [
      "제2장",
      "rebirths"
    ]
  },
  {
    "id": "balrog",
    "chapter": 1,
    "title": "불의 제단",
    "lines": [
      "페리온 불의 제단. 주니어 발록의 날개가 열기를 뿜었다.",
      "쓰러지며 그것은 낮게 웃었다. “너도… 몇 번째냐… 우리 주인은… 끝을 기다린다…”",
      "주인. 끝. 그 말이 오래 귓가에 남았다."
    ],
    "hint": "주니어 발록을 처치한다",
    "trigger": {
      "kind": "boss_kill",
      "value": "magmaKraken"
    },
    "area_filter": null,
    "weight": null,
    "body": null,
    "choices": null,
    "art_hint": null,
    "tags": [
      "제2장",
      "boss_kill"
    ]
  },
  {
    "id": "thirdJob",
    "chapter": 1,
    "title": "세 번째 시련",
    "lines": [
      "시련의 공간에서 나는 나 자신과 싸웠다. 그림자는 지난 생의 기술을 모두 쓰고 있었다.",
      "그림자를 이긴 순간 알았다. 지난 생의 나는 적이 아니라 스승이었다."
    ],
    "hint": "3차 전직을 한다",
    "trigger": {
      "kind": "job_tier",
      "value": 3
    },
    "area_filter": null,
    "weight": null,
    "body": null,
    "choices": null,
    "art_hint": null,
    "tags": [
      "제2장",
      "job_tier"
    ]
  },
  {
    "id": "rebirth5",
    "chapter": 1,
    "title": "익숙한 얼굴들",
    "lines": [
      "다섯 번째 선착장. 이제 노인과 나는 서로의 이름을 부른다.",
      "항구에는 나처럼 돌아오는 모험가들이 늘었다. 채팅 너머 낯선 이름들도, 어쩌면 같은 바다를 건너온 사람들일 것이다."
    ],
    "hint": "환생 5회를 달성한다",
    "trigger": {
      "kind": "rebirths",
      "value": 5
    },
    "area_filter": null,
    "weight": null,
    "body": null,
    "choices": null,
    "art_hint": null,
    "tags": [
      "제2장",
      "rebirths"
    ]
  },
  {
    "id": "zakum",
    "chapter": 1,
    "title": "엘나스의 불꽃",
    "lines": [
      "눈 덮인 엘나스 아래, 자쿰의 제단은 끓어올랐다. 여덟 개의 팔이 동시에 내려꽂혔다.",
      "마지막 팔이 무너질 때, 제단 벽에 새겨진 문양이 빛났다. 페리온 석상의 문자와 똑같은 문양이었다.",
      "이 대륙의 모든 것이 하나의 이야기로 이어져 있었다."
    ],
    "hint": "자쿰을 처치한다",
    "trigger": {
      "kind": "boss_kill",
      "value": "ventColossus"
    },
    "area_filter": null,
    "weight": null,
    "body": null,
    "choices": null,
    "art_hint": null,
    "tags": [
      "제2장",
      "boss_kill"
    ]
  },
  {
    "id": "aquaroad",
    "chapter": 1,
    "title": "깊은 바다의 길",
    "lines": [
      "아쿠아로드의 산호 숲은 조용했다. 물결 사이로 아주 오래된 바다의 노래가 들렸다.",
      "“이 아래에는 더 깊은 바다가 있어.” 인어가 말했다. “판게아가 생기기 전, 모든 모험가가 처음 낚싯줄을 던진 곳.”",
      "왠지 손이 낚싯대를 쥔 감각을 기억하는 것 같았다."
    ],
    "hint": "아쿠아로드 사냥터에 간다",
    "trigger": {
      "kind": "region_visit",
      "value": "아쿠아로드"
    },
    "area_filter": null,
    "weight": null,
    "body": null,
    "choices": null,
    "art_hint": null,
    "tags": [
      "제2장",
      "region_visit"
    ]
  },
  {
    "id": "rebirth10",
    "chapter": 1,
    "title": "열 번의 생",
    "lines": [
      "열 번 태어나 열 번 같은 길을 걸었다. 같은 길이지만 한 번도 같은 걸음은 아니었다.",
      "세계석은 이제 손바닥을 가득 채웠다. 그 빛 속에서, 나는 처음으로 끝이 어디인지 궁금해졌다."
    ],
    "hint": "환생 10회를 달성한다",
    "trigger": {
      "kind": "rebirths",
      "value": 10
    },
    "area_filter": null,
    "weight": null,
    "body": null,
    "choices": null,
    "art_hint": null,
    "tags": [
      "제2장",
      "rebirths"
    ]
  },
  {
    "id": "fourthJob",
    "chapter": 1,
    "title": "이름을 얻다",
    "lines": [
      "네 번째 증표에는 내 이름이 새겨져 있었다. 직업의 이름이 아니라, 내 이름이.",
      "전직관이 처음으로 웃었다. “이제야 너를 알아보겠군.”"
    ],
    "hint": "4차 전직을 한다",
    "trigger": {
      "kind": "job_tier",
      "value": 4
    },
    "area_filter": null,
    "weight": null,
    "body": null,
    "choices": null,
    "art_hint": null,
    "tags": [
      "제2장",
      "job_tier"
    ]
  },
  {
    "id": "leafre",
    "chapter": 1,
    "title": "용의 둥지",
    "lines": [
      "리프레의 하늘에는 용들이 날았다. 둥지의 알 하나가 내 발소리에 금이 갔다.",
      "하프링 장로가 말했다. “용은 시간의 신전을 지키는 종족이었다. 신전이 무너진 뒤로, 시간은 제멋대로 흐른다.”",
      "그래서 모험가들이 돌아오는 것일까. 시간이 끝을 잃어버려서."
    ],
    "hint": "리프레 사냥터에 간다",
    "trigger": {
      "kind": "region_visit",
      "value": "리프레"
    },
    "area_filter": null,
    "weight": null,
    "body": null,
    "choices": null,
    "art_hint": null,
    "tags": [
      "제2장",
      "region_visit"
    ]
  },
  {
    "id": "papulatus",
    "chapter": 1,
    "title": "멈춘 시계탑",
    "lines": [
      "루디브리엄 시계탑 꼭대기, 파풀라투스는 시간의 균열을 먹고 자라 있었다.",
      "균열이 닫히는 순간, 아주 짧게 모든 시계가 같은 시각을 가리켰다. 그리고 다시 제각각 흘렀다.",
      "시간을 고칠 수는 없었다. 하지만 시간이 어디서 망가졌는지는 알 것 같았다."
    ],
    "hint": "파풀라투스를 처치한다",
    "trigger": {
      "kind": "boss_kill",
      "value": "starfallSeraph"
    },
    "area_filter": null,
    "weight": null,
    "body": null,
    "choices": null,
    "art_hint": null,
    "tags": [
      "제2장",
      "boss_kill"
    ]
  },
  {
    "id": "temple",
    "chapter": 2,
    "title": "시간의 신전",
    "lines": [
      "기억의 길에는 내가 걸어온 생들이 그림자로 서 있었다. 첫 번째 나는 낡은 무기 하나만 들고 있었다.",
      "그림자들은 아무 말 없이 한 방향을 가리켰다. 신전보다 더 깊은 곳, 빛이 닿지 않는 강."
    ],
    "hint": "시간의 신전 사냥터에 간다",
    "trigger": {
      "kind": "region_visit",
      "value": "시간의 신전"